{
  "sources": [
    {
      "path": "docs/plans/merged-execution-shape.md",
      "origin_label": "merged-shape",
      "spine_heading": "Open for the PM — one stamp, three questions inside it"
    },
    {
      "path": "docs/plans/typed-alternative-record-seam.md",
      "origin_label": "typed-seam"
    }
  ],
  "frontmatter": {
    "title": "Bash-guard consolidated execution — the confinement band split, the duty-of-care ladder, and the typed alternative record as one plan",
    "created": "2026-07-29",
    "author": "EM",
    "status": "draft",
    "branch": "work/machine-b/2026-07-21to26",
    "plan_id": "pln-bash-guard-consolidated-execution-c51bda",
    "deliverable_id": null,
    "initiative": null,
    "scope_mode": "architecture",
    "problem_set": "inline",
    "predecessor_handoff": "state/handoffs/2026-07-29_213341_bash-guard-merged-shape-wave-one-landed.md",
    "reviewer": "the Director of Engineering/eng-director (typed-seam plan, standalone primary); EM-as-second-reviewer (merged-shape plan); consolidation review pending"
  },
  "preamble": "# Bash-guard consolidated execution\n\nTwo sessions spent a four-document memo thread negotiating a boundary between them. The PM\nhanded both batons to one session so the boundary could be dissolved instead of negotiated.\nThis plan is that dissolution: one owner, one package, one wave order.\n\nThe engineering content of the consolidation is **ordering**, not new work. Both source\nplans rewrite messages in the same guard modules — one by promoting prose up the rung\nladder, one by replacing prose with a typed record. Run in either order without\ncoordination, the same message gets authored twice. The thread existed to prevent that\nacross a session boundary; § Consolidated wave order prevents it inside one plan.\n",
  "rows": [
    {
      "id": "M1",
      "fields": {
        "disposition": "coded",
        "disposition_ref": "061134b1"
      },
      "note": "CONSOLIDATION: **LANDED** (claude-klabauter `061134b1`, with `M0`). Stamped `coded`\nduring consolidation -- the row shipped with no disposition, so it read as pending.\nVerified on disk rather than taken from the handoff: `dispatch.py` carries the `band` field,\n`guard_offer_git_c.py` and `guard_head_tail_rewrite.py` both exist as extracted modules,\n`test_hard_denies_precede_rewrites.py` is deleted (the invariant is held by construction\nnow), and `test_guard_band_membership.py` is present."
    },
    {
      "id": "M2",
      "fields": {
        "disposition": "coded",
        "disposition_ref": "2e6820d4"
      },
      "note": "CONSOLIDATION: **LANDED** (claude-klabauter `2e6820d4`, with `M3`). Stamped `coded`\nduring consolidation. Verified on disk: `find_git_segment` is defined at\n`_command_tokenizer.py:921`."
    },
    {
      "id": "M3",
      "fields": {
        "disposition": "coded",
        "disposition_ref": "2e6820d4"
      },
      "note": "CONSOLIDATION: **LANDED** (claude-klabauter `2e6820d4`, with `M2`). Stamped `coded`\nduring consolidation.\nCarry forward one correction the landing produced, because it bounds what the liveness gate\ncan prove: this row's alternative was described as removing the head/tail fork. It does not\n-- for `git log | head -n 3` the original spawns 2 processes and the alternative spawns 3,\none an interpreter startup. The real win is the platform the guard is banded for, a Windows\ncaller with no `head`, and the message now says that. **The liveness gate structurally\ncannot catch this class**: it proves an alternative runs, never that it is cheaper than what\nit replaces."
    },
    {
      "id": "M4",
      "fields": {
        "disposition": "coded",
        "disposition_ref": "29665cd57"
      },
      "note": "CONSOLIDATION: **LANDED** (coordinator-content-repo `29665cd57`,\n`state/audits/2026-07-29-grep-guard-target-class-residue.md`). Stamped `coded` during\nconsolidation. Returned verdict **(c)** against the plan's own (b) leaning: rewriting only\nthe grep segment of a composed pipeline saves ZERO forks in exactly the cases\n`search.answer` declines, so the composed-pipeline row is strictly dominated rather than\nmerely superseded. `M10` no longer carries it."
    },
    {
      "id": "M11",
      "fields": {
        "disposition": "wont_do",
        "case_against": "Cut as a scope decision during consolidation: the row's resolution state was a non-enum value that no tool could read as cut, and the work it described is not being done."
      },
      "drop_fields": [
        "disposition_ref"
      ],
      "note": "CONSOLIDATION: schema fix, carried back to the source plan as well.\n`disposition: struck` is **not a member of the plan-tasks disposition enum**\n(`open`/`coded`/`spun_off`/`backlogged`/`wont_do`), so this row's resolution state routed\nnowhere on harvest -- a cut row that no tool could see as cut. Corrected to `wont_do`,\nwhich is the enum's name for \"explicitly declined\". No change of meaning: the row is\nstruck exactly as `disposition_detail` describes.\n`disposition_ref` is dropped for two independent reasons: the schema FORBIDS it on\n`wont_do` (detail required, ref forbidden), and its value\n(`state/2026-07-29-typed-alternative-record-band-reconciliation-response.md`) is a dead\npath -- the four-document thread was archived to `archive/memos/` on settlement. The live\nlocation is\n`archive/memos/2026-07-29-typed-alternative-record-band-reconciliation-response.md`,\nrecorded here so the pointer survives its own deletion.\nThe strike itself is unchanged and correct: this row's work is done by `S2` in this plan.",
      "reason": "`disposition: struck` is not a member of the plan-tasks disposition enum (`open`/`coded`/`spun_off`/`backlogged`/`wont_do`), so the row's resolution state routed nowhere on harvest. Its `disposition_ref` was *also* schema-forbidden on a declined row, *and* a dead path — the thread it named was archived to `archive/memos/`. Fix: `disposition: wont_do`; `disposition_ref` dropped with the live archive location folded into `disposition_detail`. The strike itself is unchanged."
    },
    {
      "id": "M12",
      "fields": {
        "disposition": "wont_do",
        "pm_approved": true,
        "case_against": "Cut by PM ruling: the typed seam supersedes the prose baselines this row would pin, so building it concurrently is negative work.",
        "disposition_detail": "CUT by PM ruling 2026-07-29 (merge finding F6 accepted). Its own retirement condition was the typed seam landing, and the seam is now rows S0-S6 of this same plan -- its per-guard baselines are pinned from prose extraction and must be DISCARDED rather than migrated once the typed record replaces the prose, so building it concurrently with the thing that throws its baselines away is negative work. Re-raise only if the typed seam slips materially. Body retained as the rationale record, not a work instruction. Disposition added during consolidation: the row carried `deferred: true` with NO disposition, so a cut row read to the deferred-harvest as future work still pending."
      },
      "note": "CONSOLIDATION: schema/bookkeeping fix, carried back to the source plan as well.\nThis row was CUT by PM ruling, and its body says so plainly -- but it carried\n`deferred: true` and **no `disposition` at all**, so every mechanical reader saw a deferred\nrow awaiting future work rather than a declined one. `disposition: wont_do` plus the\nrequired `disposition_detail` now match what the body already said. Nothing about the\ndecision changes; only its machine-readable record.",
      "reason": "Cut by PM ruling, and its body says so — but it carried `deferred: true` with **no `disposition` at all**, so the deferred-harvest read a declined row as future work still pending. Fix: `disposition: wont_do` plus the required `disposition_detail`, matching what the body already said."
    },
    {
      "id": "M14",
      "fields": {
        "disposition": "wont_do",
        "pm_approved": true,
        "case_against": "Struck during consolidation: one session now holds both batons, so the collision it guarded against is unreachable.",
        "disposition_detail": "STRUCK during consolidation 2026-07-29. Its stated rationale was preventing two concurrent sessions colliding in dispatch_checks.py -- making ownership of every function answerable by filename. One session now holds both batons, so the collision is unreachable and the filename handoff it existed to enable does not happen. Striking it also retires the only row in either source plan still awaiting PM ratification, rather than asking the PM to ratify a row whose motivation has evaporated. The one non-collision-motivated piece -- removing M1's deferred-import shim -- is re-homed to the new row M14S. Restore condition: the by-guard cut being re-split across sessions.",
        "deferred": true
      },
      "note": "CONSOLIDATION: **STRUCK.** This row's stated rationale was a two-session collision\nhazard: \"a bare filename handoff would still land two concurrent sessions in the same\nfile -- the exact collision the by-guard cut exists to prevent,\" and \"ownership of every\nfunction in that file is answerable by reading a filename.\" Both batons are now held by\none session, so there is no second session to collide with and no filename handoff to\nmake answerable. The row's own body also recorded it as \"Not yet PM-ratified ... should be\nconfirmed in the same breath as [M1's] precedent\" -- striking it retires that open\nratification rather than asking the PM to ratify a row whose motivation has evaporated.\nKept as a rationale record, not a work instruction, per this workstream's convention for\ncut rows. The one piece of M14 that was NOT collision-motivated -- removing M1's\ndeferred-import shim -- is re-homed to M14S below. If the by-guard cut is ever re-split\nacross sessions, restore this row; the reasoning above is the whole restore condition.",